{
  "id": "openrouter",
  "transport": "openai_chat_completions",
  "base_url": "https://openrouter.ai/api/v1",
  "endpoint_path": "/chat/completions",
  "api_key_env": ["OPENROUTER_API_KEY"],
  "default_headers": {},
  "optional_headers": {
    "HTTP-Referer": "${OPENROUTER_HTTP_REFERER}",
    "X-Title": "${OPENROUTER_APP_TITLE}"
  },
  "capabilities": {
    "chat_completions": true,
    "streaming": true,
    "tools": "model_dependent",
    "strict_tool_schema": "model_dependent",
    "vision": "model_dependent",
    "structured_output": "model_dependent",
    "reasoning": "model_dependent",
    "token_counting": "model_dependent"
  },
  "parameter_policy": {
    "omit_null_values": true,
    "unsupported": []
  },
  "output_token_parameter": {
    "default": "max_tokens"
  }
}
