{
  "id": "groq",
  "transport": "openai_chat_completions",
  "base_url": "https://api.groq.com/openai/v1",
  "endpoint_path": "/chat/completions",
  "api_key_env": ["GROQ_API_KEY"],
  "default_headers": {},
  "capabilities": {
    "chat_completions": true,
    "streaming": true,
    "tools": "model_dependent",
    "strict_tool_schema": "model_dependent",
    "vision": "model_dependent",
    "structured_output": "model_dependent",
    "reasoning": "model_dependent",
    "token_counting": "model_dependent"
  },
  "parameter_policy": {
    "omit_null_values": true,
    "unsupported": [
      "logprobs",
      "logit_bias",
      "top_logprobs",
      "messages[].name"
    ],
    "fixed_values": {
      "n": 1
    },
    "transforms": {
      "zero_temperature_to_epsilon": true
    }
  },
  "output_token_parameter": {
    "default": "max_tokens"
  }
}
